{
  "as_of_date": "2026-08-27",
  "completed_at": "2026-08-27T12:00:00Z",
  "errors": [],
  "git_sha": "4437bd1357d9ec9e0ea694fd794f29b1076a3953",
  "input_hash": "a02518bea75848ba0aaea06719b14b42eb317f321fad4c518adb3b65aa09018d",
  "manual_review_required": true,
  "model_version": "0.2.0-research-scenario",
  "outputs": [
    "signals/runs/20260827T120000Z-research-a02518be.json",
    "reports/runs/20260827T120000Z-research-a02518be.md",
    "docs/data/runs/20260827T120000Z-research-a02518be.json",
    "agent-runs/2026/08/20260827T120000Z-research-a02518be.json"
  ],
  "run_id": "20260827T120000Z-research-a02518be",
  "run_type": "research_analysis_build",
  "schema_versions": {
    "action_thresholds": "1.0.0",
    "agent_run": "1.1.0",
    "approvals": "1.0.0",
    "event": "1.0.0",
    "model_weights": "1.0.0",
    "research_analysis": "1.0.0",
    "schedules": "1.0.0",
    "signal": "1.1.0",
    "universe": "1.0.0"
  },
  "source_manifest_hash": "84a02315be80c90e040cebc3a5ffc291d97d5773b78190e292ab4e9077279a8f",
  "started_at": "2026-08-27T12:00:00Z",
  "status": "success",
  "warnings": [
    "SYNTHETIC_RESEARCH_FIXTURE",
    "MODEL_UNCALIBRATED",
    "UNIVERSE_OWNER_APPROVAL_REQUIRED",
    "PRODUCTION_SIGNALS_DISABLED"
  ]
}
