{
  "as_of_date": "2026-08-27",
  "completed_at": "2026-08-27T12:00:00Z",
  "errors": [],
  "git_sha": "b5b8559a404a1372e5fd63f6b3f3c309affec9bb",
  "input_hash": "35e2c395daf7b7af84c61743352651535bda1c2c0b2a649eab739570d3fc6b16",
  "manual_review_required": true,
  "model_version": "0.2.0-research-scenario",
  "outputs": [
    "signals/runs/20260827T120000Z-research-35e2c395.json",
    "reports/runs/20260827T120000Z-research-35e2c395.md",
    "docs/data/runs/20260827T120000Z-research-35e2c395.json",
    "agent-runs/2026/08/20260827T120000Z-research-35e2c395.json"
  ],
  "run_id": "20260827T120000Z-research-35e2c395",
  "run_type": "research_analysis_build",
  "schema_versions": {
    "action_thresholds": "1.0.0",
    "agent_run": "1.1.0",
    "approvals": "1.0.0",
    "event": "1.0.0",
    "model_weights": "1.0.0",
    "research_analysis": "1.0.0",
    "schedules": "1.0.0",
    "signal": "1.1.0",
    "universe": "1.0.0"
  },
  "source_manifest_hash": "84a02315be80c90e040cebc3a5ffc291d97d5773b78190e292ab4e9077279a8f",
  "started_at": "2026-08-27T12:00:00Z",
  "status": "success",
  "warnings": [
    "SYNTHETIC_RESEARCH_FIXTURE",
    "MODEL_UNCALIBRATED",
    "UNIVERSE_OWNER_APPROVAL_REQUIRED",
    "PRODUCTION_SIGNALS_DISABLED"
  ]
}
